### ISSUE TITLE
Password doesn't change, without any error - Linux/Docker Installation 

### ISSUE THREAD

**Issue by mdzieciol** [unosquare/passcore#267]
**PassCore Server**
- OS: Linux
- Provider: Active Directory
- Settings file (without sensitive information): 

>  "Logging": {
>     "IncludeScopes": false,
>     "LogLevel": {
>       "Default": "Debug",
>       "System": "Information",
>       "Microsoft": "Information"
>     }
>   },
>   "WebSettings": {
>     "EnableHttpsRedirect": true
>   },
>   "AppSettings": {
>     // The following options for AD Provider (remove if you don't use this Provider)
>     "UseAutomaticContext": true, // Set true to allow PassCore to reset password using the same credentials, or false if you will fill the credentials below
>     "RestrictedADGroups": [
>       "Administrators",
>       "Domain Admins",
>       "Enterprise Admins"
>     ], // Set the AD groups to restrict the use of PassCore
>     "AllowedADGroups": [], // Set the AD Groups to allow PassCore, if the array is empty all the groups no-restricted above are allowed
>     "IdTypeForUser": "UPN", // Possible values are "DN", "GUID", "Name", "SAM", "SID" and "UPN" (Default UPN)
>     "UpdateLastPassword": false, // Set true to allow PassCore to  update the last password timestamp
>     // The following options are for LDAP Provider (remove if you don't use this Provider)
>     "LdapSearchBase": "ou=people,dc=example,dc=com",
>     "LdapSecureSocketLayer": false, // Default for AD is true when using LDAPS 636
>     "LdapStartTls": false, // Default for AD is true when using LDAP 389
>     "LdapChangePasswordWithDelAdd": true,
>     "LdapSearchFilter": "(sAMAccountName={Username})", // Another value: "(&(objectClass=person)(cn={Username}))"
>     // General options (valid for both providers)
>     "LdapHostnames": [ "" ], // Set your hostname(s)
>     "LdapPort": 389, // Default for AD is 389, for LDAPS 636
>     "LdapUsername": "", // Set the username or distinguish name (DN) to bind the LDAP server
>     "LdapPassword": "", // Set the password for the username
>     "DefaultDomain": "" // Set your default AD domain here, or non "@" logins will not work! Use empty value to allow user to set the domain. This option is ONLY available with UPN.
>   },
>   "ClientSettings": {
>     "ValidationRegex": {
>       "EmailRegex": "^[a-zA-Z0-9.!#$%&’*+/=?^_`{|}~-]+@[a-zA-Z0-9-]+(?:\\.[a-zA-Z0-9-]+)*$",
>       "UsernameRegex": "^[a-zA-Z0-9._-]{3,20}$"
>     },
>     "ShowPasswordMeter": true,
>     "Recaptcha": {
>       "SiteKey": "", // ReCAPTCHA public key: replace this! or leave empty if you don't need ReCAPTCHA
>       "PrivateKey": "", // ReCAPTCHA private key: replace this! or leave empty if you don't need ReCAPTCHA
>       "LanguageCode": "en"
>     },
>     "UseEmail": "true",
>     "ApplicationTitle": "Change Account Password | Self-Service Account Management Tools",
>     "ChangePasswordTitle":  "Change Account Password",
>     "ChangePasswordForm": {
>       "HelpText": "If you are having trouble with this tool, please contact IT Support",
>       "UsernameLabel": "Username",
>       "UsernameHelpblock": "Your organization's email address",
>       "UsernameDefaultDomainHelperBlock": "Your organization's username",
>       "CurrentPasswordLabel": "Current Password",
>       "CurrentPasswordHelpblock": "Enter your current password",
>       "NewPasswordLabel": "New Password",
>       "NewPasswordHelpblock": "Enter a <a href='https://support.microsoft.com/en-us/help/4026406/microsoft-account-create-a-strong-password' target='_blank'>strong password</a>. Yo$
>       "NewPasswordVerifyLabel": "Re-enter New Password",
>       "NewPasswordVerifyHelpblock": "Enter your new password again",
>       "ChangePasswordButtonLabel": "Change Password"
>     },
>     "ErrorsPasswordForm": {
>       "FieldRequired": "This field is required",
>       "UsernamePattern": "Please enter a valid username",
>       "UsernameEmailPattern": "Please enter a valid email address",
>       "PasswordMatch": "Passwords do not match"
>     },
>     "Alerts": {
>       "SuccessAlertTitle": "You have changed your password successfully.",
>       "SuccessAlertBody": "Please note it may take a few hours for your new password to reach all domain controllers.",
>       "ErrorPasswordChangeNotAllowed": "You are not allowed to change your password. Please contact your system administrator.",
>       "ErrorInvalidCredentials": "You need to provide the correct current password.",
>       "ErrorInvalidDomain": "You have supplied an invalid domain to logon to.",
>       "ErrorInvalidUser": "We could not find your user account.",
>       "ErrorCaptcha": "Could not verify you are not a robot.",
>       "ErrorFieldRequired": "Fulfill all the fields.",
>       "ErrorFieldMismatch": "The passwords do not match.",
>       "ErrorConnectionLdap": "Unhandled error connecting to the LDAP server."
>     }
>   }
> }

**Describe the bug**
Using command:

> docker run \
> -e AppSettings__LdapHostnames__0='dc01.ad.XXX.net'  \
> -e AppSettings__LdapPort='389'  \
> -e AppSettings__LdapUsername='CN=passcore,OU=XXX,DC=ad,DC=XXX,DC=net'  \
> -e AppSettings__LdapPassword='Testtest%%'  \
> -e AppSettings__LdapSearchBase='OU=XXX,DC=ad,DC=XXX,DC=net'  \
> -e AppSettings__UpdateLastPassworde='true'  \
> -e ClientSettings__UseEmail='false'   \
> -e AppSettings__LdapChangePasswordWithDelAdd=false  \
> -e AppSettings__IdTypeForUse='SAM' \
> -it -p 80:80 passcore:latest

I have a problem with changing a password. 
After putting username, password and twice new password in the form, I have clean info about successfully changed password:
"You have changed your password successfully.
Please note it may take a few hours for your new password to reach all domain controllers."

But there is no change in Active Directory.

I've tried to sniff traffic between AD server and app server and I have proper communication:
 
2

> 58490	5771.067444	10.11.99.103	10.11.99.62		TCP	74	34343 → 389 [SYN] Seq=0 Win=29200 Len=0 MSS=1460 SACK_PERM=1 TSval=467791697 TSecr=0 WS=128
> 258491	5771.067786	10.11.99.62		10.11.99.103	TCP	74	389 → 34343 [SYN, ACK] Seq=0 Ack=1 Win=8192 Len=0 MSS=1460 WS=256 SACK_PERM=1 TSval=119773886 TSecr=467791697
> 258492	5771.068579	10.11.99.103	10.11.99.62		TCP	66	34343 → 389 [ACK] Seq=1 Ack=1 Win=29312 Len=0 TSval=467791698 TSecr=119773886
> 258493	5771.082433	10.11.99.103	10.11.99.62		LDAP	138	bindRequest(5) "CN=passcore,OU=XXX,DC=ad,DC=XXX,DC=net" simple 
> 258494	5771.086198	10.11.99.62		10.11.99.103	LDAP	88	bindResponse(5) success 
> 258495	5771.087005	10.11.99.103	10.11.99.62		TCP	66	34343 → 389 [ACK] Seq=73 Ack=23 Win=29312 Len=0 TSval=467791717 TSecr=119773901
> 258496	5771.094469	10.11.99.103	10.11.99.62		LDAP	181	searchRequest(6) "OU=XXX,DC=ad,DC=XXX,DC=net" wholeSubtree 
> 258497	5771.095594	10.11.99.62		10.11.99.103	LDAP	268	searchResEntry(6) "CN=M usr. Dzieciol,OU=WAW,OU=XXX,DC=ad,DC=XXX,DC=net"  | searchResDone(6) success  [1 result]
> 258499	5771.101004	10.11.99.103	10.11.99.62		LDAP	179	modifyRequest(7) "CN=M usr. Dzieciol,OU=WAW,OU=XXX,DC=ad,DC=XXX,DC=net" 
> 258500	5771.102048	10.11.99.62		10.11.99.103	LDAP	88	modifyResponse(7) success 
> 258502	5771.105617	10.11.99.103	10.11.99.62		LDAP	73	unbindRequest(8) 
> 258503	5771.105761	10.11.99.103	10.11.99.62		TCP	66	34343 → 389 [FIN, ACK] Seq=308 Ack=247 Win=30336 Len=0 TSval=467791736 TSecr=119773915
> 258504	5771.105813	10.11.99.62		10.11.99.103	TCP	66	389 → 34343 [ACK] Seq=247 Ack=309 Win=263168 Len=0 TSval=119773924 TSecr=467791736
> 258505	5771.106082	10.11.99.62		10.11.99.103	TCP	54	389 → 34343 [RST, ACK] Seq=247 Ack=309 Win=0 Len=0`
> 

**To Reproduce**

Do similar settings and try to change the password for AD user.

**Expected behavior**

The password doesn't change despite the fact that there wasn't any error in logs and GUI.

**Comment by mdzieciol** [comment]
any news?

**Comment by geoperez** [comment]
Can you check issue #260? I think you need to change to secure connection.

**Comment by Tomthi** [comment]
I'm seeing similar behavior. I have enabled LdapStartTLS=true, it does recognize the username but it's not checking the PW. I can put in any password and it will return that the PW was changed successfully.  I can put in an invalid user and it does recognize that it does not exist. 

There are no errors in the logs. I'm using a container with AWS Directory Services. I have enabled LDAPs and verified that you can connect using LDAPs.
